<animal xmlns:xsi="http://www.w3.org/2001/XMLSchema-instance" xsi:noNamespaceSchemaLocation="file:./resources/species/specie.xsd">
    <names>
        <fr>Tigre de Sumatra</fr>
        <additionalFrenchNames>
        </additionalFrenchNames>
        <en>Sumatran tiger</en>
        <additionalEnglishNames>
        </additionalEnglishNames>
        <scientific>Panthera tigris sumatrae</scientific>
    </names>
    <general>
        <uicn>4</uicn>
        <family>8</family>
        <continents>
            <continent>5</continent>
        </continents>
        <ecoregion>0</ecoregion>
    </general>
    <documentation>
        <frenchWikipedia></frenchWikipedia>
        <englishWikipedia></englishWikipedia>
        <animalDiversity></animalDiversity>
    </documentation>
    <reproduction>
        <femaleMaturity>30</femaleMaturity>
        <maleMaturity>42</maleMaturity>
        <gestationFrequency>0.3</gestationFrequency>
        <litterSize>3</litterSize>
        <leavingAge>0</leavingAge>
    </reproduction>
    <lifespan>
        <femaleLifespan>180</femaleLifespan>
        <maleLifespan>180</maleLifespan>
    </lifespan>
    <territory>
        <biome>1</biome>
        <territorySize>200</territorySize>
    </territory>
    <feeding>
        <diet>3</diet>
        <quantity>3.0</quantity>
        <size>6</size>
    </feeding>
    <social>
        <groupSize>1</groupSize>
    </social>
</animal>