<animal xmlns:xsi="http://www.w3.org/2001/XMLSchema-instance" xsi:noNamespaceSchemaLocation="file:./resources/species/specie.xsd">
    <names>
        <fr>ZEBRE2_fr</fr>
        <en>ZEBRE2_en</en>
        <scientific>ZEBRE2</scientific>
    </names>
    <general>
        <uicn>2</uicn>
        <family>2</family>
        <continents>
            <continent>2</continent>
        </continents>
        <ecoregion>0</ecoregion>
    </general>
    <reproduction>
        <femaleMaturity>66</femaleMaturity>
        <maleMaturity>42</maleMaturity>
        <gestationFrequency>0</gestationFrequency>
        <litterSize>1</litterSize>
        <leavingAge>22</leavingAge>
    </reproduction>
    <lifespan>
        <femaleLifespan>240</femaleLifespan>
        <maleLifespan>240</maleLifespan>
    </lifespan>
    <territory>
        <biome>13</biome>
        <territorySize>9.4</territorySize>
    </territory>
    <feeding>
        <diet>2</diet>
        <quantity>5.7</quantity>
        <size>2</size>
    </feeding>
    <social>
        <groupSize>10</groupSize>
    </social>
</animal>