<?xml version="1.0" encoding="UTF-8"?>
<animal xmlns:xsi="http://www.w3.org/2001/XMLSchema-instance" xsi:noNamespaceSchemaLocation="file:./resources/species/specie.xsd">
  <names>
    <fr>Tamarin de Goeldi</fr>
    <additionalFrenchNames>
      <name>Callimico</name>
      <name>Tamarin sauteur</name>
    </additionalFrenchNames>
    <en>Goeldi's marmoset</en>
    <additionalEnglishNames>
      <name>Goeldi's monkey</name>
      <name>Goeldi's tamarin</name>
      <name>Spring tamarin</name>
      <name>Callimico</name>
    </additionalEnglishNames>
    <scientific>Callimico goeldi</scientific>
  </names>
  <general>
    <uicn>3</uicn>
    <family>26</family>
    <continents>
      <continent>2</continent>
    </continents>
    <ecoregion>0</ecoregion>
  </general>
  <documentation>
    <frenchWikipedia>https://fr.wikipedia.org/wiki/Tamarin_de_Goeldi</frenchWikipedia>
    <englishWikipedia>https://en.wikipedia.org/wiki/Goeldi%27s_marmoset</englishWikipedia>
    <animalDiversity />
  </documentation>
  <reproduction>
    <femaleMaturity>14</femaleMaturity>
    <maleMaturity>14</maleMaturity>
    <gestationFrequency>2</gestationFrequency>
    <litterSize>1</litterSize>
    <leavingAge>0</leavingAge>
  </reproduction>
  <lifespan>
    <femaleLifespan>144</femaleLifespan>
    <maleLifespan>144</maleLifespan>
  </lifespan>
  <territory>
    <territorySize>48</territorySize>
    <biomes>
      <biome>1</biome>
    </biomes>
  </territory>
  <feeding>
    <quantity>0.108</quantity>
    <size>1</size>
    <diets>
      <diet>17</diet>
    </diets>
  </feeding>
  <social>
    <groupSize>8</groupSize>
  </social>
</animal>
