<?xml version="1.0" encoding="UTF-8"?>
<animal xmlns:xsi="http://www.w3.org/2001/XMLSchema-instance" xsi:noNamespaceSchemaLocation="file:./resources/species/specie.xsd">
  <names>
    <fr>Hocheur à ventre roux</fr>
    <additionalFrenchNames>
      <name>Hocheur à ventre rouge</name>
      <name>Singe à ventre rouge</name>
    </additionalFrenchNames>
    <en>Red-bellied monkey</en>
    <additionalEnglishNames>
      <name>White-throated guenon</name>
      <name>Red-bellied guenon</name>
    </additionalEnglishNames>
    <scientific>Cercopithecus erythrogaster</scientific>
  </names>
  <general>
    <uicn>3</uicn>
    <family>31</family>
    <continents>
      <continent>1</continent>
    </continents>
    <ecoregion>0</ecoregion>
    <breedingProgramme>0</breedingProgramme>
  </general>
  <documentation>
    <frenchWikipedia>https://fr.wikipedia.org/wiki/Cercopithecus_erythrogaster</frenchWikipedia>
    <englishWikipedia>https://en.wikipedia.org/wiki/White-throated_guenon</englishWikipedia>
    <animalDiversity />
  </documentation>
  <reproduction>
    <femaleMaturity>36</femaleMaturity>
    <maleMaturity>36</maleMaturity>
    <gestationFrequency>1</gestationFrequency>
    <litterSize>1</litterSize>
    <leavingAge>6</leavingAge>
  </reproduction>
  <lifespan>
    <femaleLifespan>230</femaleLifespan>
    <maleLifespan>230</maleLifespan>
  </lifespan>
  <territory>
    <territorySize>80</territorySize>
    <biomes>
      <biome>1</biome>
    </biomes>
  </territory>
  <feeding>
    <quantity>0.708</quantity>
    <size>1</size>
    <diets>
      <diet>17</diet>
    </diets>
  </feeding>
  <social>
    <groupSize>10</groupSize>
  </social>
</animal>
