<animal xmlns:xsi="http://www.w3.org/2001/XMLSchema-instance" xsi:noNamespaceSchemaLocation="file:./resources/species/specie.xsd">
    <names>
        <fr>Jaguar</fr>
        <en>Jaguar</en>
        <scientific>Panthera onca</scientific>
    </names>
    <general>
        <uicn>2</uicn>
        <family>8</family>
        <continents>
            <continent>2</continent>
        </continents>
        <ecoregion>0</ecoregion>
    </general>
    <reproduction>
        <femaleMaturity>30</femaleMaturity>
        <maleMaturity>42</maleMaturity>
        <gestationFrequency>0.5</gestationFrequency>
        <litterSize>3</litterSize>
        <leavingAge>0</leavingAge>
    </reproduction>
    <lifespan>
        <femaleLifespan>162</femaleLifespan>
        <maleLifespan>162</maleLifespan>
    </lifespan>
    <territory>
        <biome>1</biome>
        <territorySize>150</territorySize>
    </territory>
    <feeding>
        <diet>3</diet>
        <quantity>4.2</quantity>
        <size>5</size>
    </feeding>
    <social>
        <groupSize>1</groupSize>
    </social>
</animal>