<?xml version="1.0" encoding="UTF-8"?>
<animal xmlns:xsi="http://www.w3.org/2001/XMLSchema-instance" xsi:noNamespaceSchemaLocation="file:./resources/species/specie.xsd">
  <names>
    <fr>NULL</fr>
    <additionalFrenchNames />
    <en>Diana monkey</en>
    <additionalEnglishNames>
    </additionalEnglishNames>
    <scientific>Cercopithecus nigroviridis</scientific>
  </names>
  <general>
    <uicn>3</uicn>
    <family>31</family>
    <continents>
      <continent>1</continent>
    </continents>
    <ecoregion>0</ecoregion>
  </general>
  <documentation>
    <frenchWikipedia>https://fr.wikipedia.org/wiki/Cercopith√®que_diane</frenchWikipedia>
    <englishWikipedia>https://en.wikipedia.org/wiki/Diana_monkey</englishWikipedia>
    <animalDiversity />
  </documentation>
  <reproduction>
    <femaleMaturity>36</femaleMaturity>
    <maleMaturity>36</maleMaturity>
    <gestationFrequency>1</gestationFrequency>
    <litterSize>1</litterSize>
    <leavingAge>6</leavingAge>
  </reproduction>
  <lifespan>
    <femaleLifespan>240</femaleLifespan>
    <maleLifespan>240</maleLifespan>
  </lifespan>
  <territory>
    <territorySize>120</territorySize>
    <biomes>
      <biome>1</biome>
    </biomes>
  </territory>
  <feeding>
    <quantity>0.603</quantity>
    <size>1</size>
    <diets>
      <diet>17</diet>
    </diets>
  </feeding>
  <social>
    <groupSize>15</groupSize>
  </social>
</animal>
