<?xml version="1.0" encoding="UTF-8"?>
<animal xmlns:xsi="http://www.w3.org/2001/XMLSchema-instance" xsi:noNamespaceSchemaLocation="file:./resources/species/specie.xsd">
    <names>
        <fr>Chien des buissons</fr>
        <additionalFrenchNames>
            <name>Chien-bois</name>
        </additionalFrenchNames>
        <en>Bush dog</en>
        <additionalEnglishNames>
        </additionalEnglishNames>
        <scientific>Speothos venaticus</scientific>
    </names>
    <general>
        <uicn>2</uicn>
        <family>1</family>
        <continents>
            <continent>2</continent>
        </continents>
        <ecoregion>0</ecoregion>
        <breedingProgramme>1</breedingProgramme>
    </general>
    <documentation>
        <frenchWikipedia>https://fr.wikipedia.org/wiki/Chien_des_buissons</frenchWikipedia>
        <englishWikipedia>https://en.wikipedia.org/wiki/Bush_dog</englishWikipedia>
        <animalDiversity />
    </documentation>
    <reproduction>
        <femaleMaturity>12</femaleMaturity>
        <maleMaturity>12</maleMaturity>
        <gestationFrequency>1.33</gestationFrequency>
        <litterSize>4</litterSize>
        <leavingAge>0</leavingAge>
    </reproduction>
    <lifespan>
        <femaleLifespan>120</femaleLifespan>
        <maleLifespan>120</maleLifespan>
    </lifespan>
    <territory>
        <territorySize>260</territorySize>
        <biomes>
            <biome>1</biome>
            <biome>2</biome>
        </biomes>
    </territory>
    <feeding>
        <quantity>0.3</quantity>
        <size>2</size>
        <diets>
            <diet>3</diet>
        </diets>
    </feeding>
    <social>
        <groupSize>10</groupSize>
    </social>
</animal>
