<?xml version="1.0" encoding="UTF-8"?>
<animal xmlns:xsi="http://www.w3.org/2001/XMLSchema-instance" xsi:noNamespaceSchemaLocation="file:./resources/species/specie.xsd">
    <names>
        <fr>Manul</fr>
        <additionalFrenchNames>
            <name>Chat de Pallas</name>
        </additionalFrenchNames>
        <en>Manul</en>
        <additionalEnglishNames>
            <name>Palla's cat</name>
        </additionalEnglishNames>
        <scientific>Otocolopus manul</scientific>
    </names>
    <general>
        <uicn>2</uicn>
        <family>8</family>
        <continents>
            <continent>5</continent>
        </continents>
        <ecoregion>0</ecoregion>
        <breedingProgramme>1</breedingProgramme>
    </general>
    <documentation>
        <frenchWikipedia>https://fr.wikipedia.org/wiki/Palla's_cat</frenchWikipedia>
        <englishWikipedia>https://en.wikipedia.org/wiki/Chat-de-Pallas</englishWikipedia>
        <animalDiversity />
    </documentation>
    <reproduction>
        <femaleMaturity>12</femaleMaturity>
        <maleMaturity>12</maleMaturity>
        <gestationFrequency>1</gestationFrequency>
        <gestationDuration>2</gestationDuration>
        <litterSize>4</litterSize>
        <leavingAge>5</leavingAge>
    </reproduction>
    <lifespan>
        <femaleLifespan>294</femaleLifespan>
        <maleLifespan>294</maleLifespan>
    </lifespan>
    <territory>
        <territorySize>40</territorySize>
        <biomes>
            <biome>1</biome>
            <biome>2</biome>
            <biome>10</biome>
            <biome>13</biome>
        </biomes>
    </territory>
    <feeding>
        <quantity>0.360</quantity>
        <size>2</size>
        <diets>
            <diet>3</diet>
        </diets>
        <fastDays>1</fastDays>
    </feeding>
    <social>
        <groupSize>1</groupSize>
    </social>
</animal>
