<animal xmlns:xsi="http://www.w3.org/2001/XMLSchema-instance" xsi:noNamespaceSchemaLocation="file:./resources/species/specie.xsd">
    <names>
        <fr>Tapir de Malaisie</fr>
        <additionalFrenchNames>
            <name>Tapir d'Asie</name>
            <name>Tapir Ã  chabraques</name>
        </additionalFrenchNames>
        <en>Malayan tapir</en>
        <additionalEnglishNames>
            <name>Indian tapir</name>
        </additionalEnglishNames>
        <scientific>Tapirus indicus</scientific>
    </names>
    <general>
        <uicn>4</uicn>
        <family>27</family>
        <continents>
            <continent>5</continent>
        </continents>
        <ecoregion>0</ecoregion>
    </general>
    <documentation>
        <frenchWikipedia>https://fr.wikipedia.org/wiki/Tapir_de_Malaisie</frenchWikipedia>
        <englishWikipedia>https://en.wikipedia.org/wiki/Malayan_tapir</englishWikipedia>
        <animalDiversity></animalDiversity>
    </documentation>
    <reproduction>
        <femaleMaturity>32</femaleMaturity>
        <maleMaturity>36</maleMaturity>
        <gestationFrequency>0.5</gestationFrequency>
        <litterSize>1</litterSize>
        <leavingAge>0</leavingAge>
    </reproduction>
    <lifespan>
        <femaleLifespan>300</femaleLifespan>
        <maleLifespan>300</maleLifespan>
    </lifespan>
    <territory>
        <biome>1</biome>
        <territorySize>36</territorySize>
    </territory>
    <feeding>
        <diet>8</diet>
        <quantity>15</quantity>
        <size>7</size>
    </feeding>
    <social>
        <groupSize>1</groupSize>
    </social>
</animal>