<animal xmlns:xsi="http://www.w3.org/2001/XMLSchema-instance" xsi:noNamespaceSchemaLocation="file:./resources/species/specie.xsd">
    <names>
        <fr>Panthère des neiges</fr>
        <additionalFrenchNames>
            <name>Léopard des neiges</name>
            <name>Once</name>
            <name>Irbis</name>
        </additionalFrenchNames>
        <en>Snow leopard</en>
        <additionalEnglishNames>
            <name>Ounce</name>
        </additionalEnglishNames>
        <scientific>Uncia uncia</scientific>
    </names>
    <general>
        <uicn>4</uicn>
        <family>8</family>
        <continents>
            <continent>5</continent>
        </continents>
        <ecoregion>0</ecoregion>
    </general>
    <reproduction>
        <femaleMaturity>30</femaleMaturity>
        <maleMaturity>42</maleMaturity>
        <gestationFrequency>0.5</gestationFrequency>
        <litterSize>3</litterSize>
        <leavingAge>0</leavingAge>
    </reproduction>
    <lifespan>
        <femaleLifespan>180</femaleLifespan>
        <maleLifespan>180</maleLifespan>
    </lifespan>
    <territory>
        <biome>10</biome>
        <territorySize>150</territorySize>
    </territory>
    <feeding>
        <diet>3</diet>
        <quantity>2.9</quantity>
        <size>4</size>
    </feeding>
    <social>
        <groupSize>1</groupSize>
    </social>
</animal>