<?xml version="1.0" encoding="UTF-8"?>
<animal xmlns:xsi="http://www.w3.org/2001/XMLSchema-instance" xsi:noNamespaceSchemaLocation="file:./resources/species/specie.xsd">
  <names>
    <fr>Gibbon à favoris roux</fr>
    <additionalFrenchNames>
        <name>Gibbon à joues jaunes</name>
    </additionalFrenchNames>
    <en>Yellow-cheeked gibbon</en>
    <additionalEnglishNames>
      <name>Golden-cheeked gibbon</name>
      <name>Yellow-cheeked crested gibbon</name>
      <name>Golden-cheeked crested gibbon</name>
      <name>Red-cheeked gibbon</name>
      <name>Buffed-cheeked gibbon</name>
      <name>gabriella's gibbon</name>
    </additionalEnglishNames>
    <scientific>Nomascus gabriellae</scientific>
  </names>
  <general>
    <uicn>4</uicn>
    <family>30</family>
    <continents>
      <continent>5</continent>
    </continents>
    <ecoregion>0</ecoregion>
    <breedingProgramme>1</breedingProgramme>
  </general>
  <documentation>
    <frenchWikipedia>https://fr.wikipedia.org/wiki/Nomascus_gabriellae</frenchWikipedia>
    <englishWikipedia>https://en.wikipedia.org/wiki/Yellow-cheeked_gibbon</englishWikipedia>
    <animalDiversity />
  </documentation>
  <reproduction>
    <femaleMaturity>84</femaleMaturity>
    <maleMaturity>84</maleMaturity>
    <gestationFrequency>0.4</gestationFrequency>
    <litterSize>1</litterSize>
    <leavingAge>84</leavingAge>
  </reproduction>
  <lifespan>
    <femaleLifespan>480</femaleLifespan>
    <maleLifespan>480</maleLifespan>
  </lifespan>
  <territory>
    <territorySize>100</territorySize>
    <biomes>
      <biome>2</biome>
    </biomes>
  </territory>
  <feeding>
    <quantity>0.894</quantity>
    <size>2</size>
    <diets>
      <diet>5</diet>
    </diets>
  </feeding>
  <social>
    <groupSize>2</groupSize>
  </social>
  <tags>
      <frenchTags>
          <tag>Mammifère</tag>
          <tag>Primate</tag>
          <tag>Singe</tag>
          <tag>Gibbon</tag>
      </frenchTags>
      <englishTags>
          <tag>Mammal</tag>
          <tag>Primate</tag>
          <tag>Monkey</tag>
          <tag>Gibbon</tag>
      </englishTags>
  </tags>
</animal>
