<?xml version="1.0" encoding="UTF-8"?>
<animal xmlns:xsi="http://www.w3.org/2001/XMLSchema-instance" xsi:noNamespaceSchemaLocation="file:./resources/species/specie.xsd">
  <names>
    <fr>Grivet</fr>
    <additionalFrenchNames>
      <name>Singe vert</name>
      <name>Grivet d'Ethiopie</name>
    </additionalFrenchNames>
    <en>Vervet</en>
    <additionalEnglishNames>
      <name>Vervet monkey</name>
      <name>Grivet</name>
      <name>Green monkey</name>
    </additionalEnglishNames>
    <scientific>Chlorocebus pygerythrus</scientific>
  </names>
  <general>
    <uicn>1</uicn>
    <family>31</family>
    <continents>
      <continent>1</continent>
    </continents>
    <ecoregion>0</ecoregion>
    <breedingProgramme>0</breedingProgramme>
  </general>
  <documentation>
    <frenchWikipedia>https://fr.wikipedia.org/wiki/Chlorocebus_aethiops</frenchWikipedia>
    <englishWikipedia>https://en.wikipedia.org/wiki/Vervet_monkey</englishWikipedia>
    <animalDiversity />
  </documentation>
  <reproduction>
    <femaleMaturity>36</femaleMaturity>
    <maleMaturity>72</maleMaturity>
    <gestationFrequency>0.5</gestationFrequency>
    <litterSize>1</litterSize>
    <leavingAge>0</leavingAge>
  </reproduction>
  <lifespan>
    <femaleLifespan>360</femaleLifespan>
    <maleLifespan>360</maleLifespan>
  </lifespan>
  <territory>
    <territorySize>40</territorySize>
    <biomes>
      <biome>7</biome>
    </biomes>
  </territory>
 <feeding>
    <quantity>0.772</quantity>
    <size>2</size>
    <diets>
      <diet>17</diet>
    </diets>
  </feeding>
  <social>
    <groupSize>5</groupSize>
  </social>
  <tags>
      <frenchTags>
          <tag>Mammif√®re</tag>
          <tag>Primate</tag>
      </frenchTags>
      <englishTags>
          <tag>Mammal</tag>
          <tag>Primate</tag>
          <tag>Monkey</tag>
      </englishTags>
  </tags>
</animal>
