<animal xmlns:xsi="http://www.w3.org/2001/XMLSchema-instance" xsi:noNamespaceSchemaLocation="file:./specie.xsd">
    <names>
        <fr>Maki catta</fr>
        <en>Ring-tailed lemur</en>
        <scientific>Lemur catta</scientific>
    </names>
    <reproduction>
        <femaleMaturity>36</femaleMaturity>
        <maleMaturity>42</maleMaturity>
        <gestationFrequency>1</gestationFrequency>
        <litterSize>1</litterSize>
    </reproduction>
    <lifespan>
        <femaleLifespan>324</femaleLifespan>
        <maleLifeSpan>324</maleLifeSpan>
    </lifespan>
</animal>
