<?xml version="1.0" encoding="UTF-8"?>
<animal xmlns:xsi="http://www.w3.org/2001/XMLSchema-instance" xsi:noNamespaceSchemaLocation="file:./resources/species/specie.xsd">
  <names>
    <fr>Tamarin lion à tête dorée</fr>
    <additionalFrenchNames>
      <name>Singe-lion à tête dorée</name>
    </additionalFrenchNames>
    <en>Golden-headed lion tamarin</en>
    <additionalEnglishNames>
      <name>Golden-headed tamarin</name>
    </additionalEnglishNames>
    <scientific>Leontopithecus chrysomelas</scientific>
  </names>
  <general>
    <uicn>4</uicn>
    <family>26</family>
    <continents>
      <continent>2</continent>
    </continents>
    <ecoregion>0</ecoregion>
    <breedingProgramme>1</breedingProgramme>
  </general>
  <documentation>
    <frenchWikipedia>https://fr.wikipedia.org/wiki/Tamarin_lion_%C3%A0_t%C3%AAte_dor%C3%A9e</frenchWikipedia>
    <englishWikipedia>https://en.wikipedia.org/wiki/Golden-headed_lion_tamarin</englishWikipedia>
    <animalDiversity />
  </documentation>
  <reproduction>
    <femaleMaturity>18</femaleMaturity>
    <maleMaturity>24</maleMaturity>
    <gestationFrequency>1</gestationFrequency>
    <litterSize>2</litterSize>
    <leavingAge>0</leavingAge>
  </reproduction>
  <lifespan>
    <femaleLifespan>216</femaleLifespan>
    <maleLifespan>216</maleLifespan>
  </lifespan>
  <territory>
    <territorySize>12</territorySize>
    <biomes>
      <biome>1</biome>
    </biomes>
  </territory>
  <feeding>
    <quantity>0.148</quantity>
    <size>1</size>
    <diets>
      <diet>17</diet>
    </diets>
  </feeding>
  <social>
    <groupSize>4</groupSize>
  </social>
    <tags>
        <frenchTags>
            <tag>Mammifère</tag>
            <tag>Primate</tag>
            <tag>Singe</tag>
            <tag>Tamarin</tag>
            <tag>Lion</tag>
            <tag>Tête</tag>
            <tag>Or</tag>
            <tag>Doré</tag>
            <tag>Dorée</tag>
        </frenchTags>
        <englishTags>
            <tag>Mammal</tag>
            <tag>Primate</tag>
            <tag>Monkey</tag>
            <tag>Gold</tag>
            <tag>Golden</tag>
            <tag>Head</tag>
            <tag>Headed</tag>
            <tag>Tamarin</tag>
            <tag>Lion</tag>
        </englishTags>
    </tags>
</animal>
